{
  "categories": [
    "baseline-curated"
  ],
  "curation": {
    "gap_notes": [
      "No verified OpenAPI/Swagger surface yet.",
      "No verified subnet API surface yet.",
      "No verified SSE/event stream yet.",
      "No verified data artifact yet."
    ],
    "level": "machine-verified",
    "review_state": "machine-generated",
    "reviewed_at": null,
    "source_count": 3,
    "verified_at": "2026-06-06T07:44:02.909Z"
  },
  "dashboard_url": "https://dashboard.harnyx.ai/benchmark",
  "docs_url": "https://github.com/tensorplex-labs/subnet-docs/tree/main/data/67",
  "links": [],
  "name": "Harnyx",
  "netuid": 67,
  "notes": "Machine-generated baseline overlay from verified public-source candidates.",
  "schema_version": 1,
  "slug": "sn-67",
  "source_repo": "https://github.com/harnyx/harnyx",
  "status": "active",
  "surfaces": [
    {
      "auth_required": false,
      "authority": "registry-observed",
      "id": "sn-67-tensorplex-source-repo-1",
      "kind": "source-repo",
      "name": "Harnyx source repository",
      "notes": "Discovered from Tensorplex subnet-docs. Not probed or verified by Metagraphed. Source refresh failed; preserved pending a successful refresh.",
      "probe": {
        "enabled": true,
        "expect": "any",
        "method": "HEAD",
        "timeout_ms": 10000
      },
      "provider": "tensorplex-subnet-docs",
      "public_safe": true,
      "quality_signals": {
        "content_type_matches_kind": true,
        "public_safe": true,
        "rate_limited": false,
        "redirected": false,
        "source_tier": "community-docs",
        "transient_failure": false
      },
      "rate_limit_notes": "Candidate only; no recurring probe is configured until maintainer review.",
      "source_urls": [
        "https://github.com/tensorplex-labs/subnet-docs/blob/main/data/67/subnet.json"
      ],
      "url": "https://github.com/harnyx/harnyx",
      "verification": {
        "classification": "live",
        "confidence_score": 55,
        "content_type": null,
        "github_api_url": "https://api.github.com/repos/harnyx/harnyx",
        "latency_ms": 559,
        "method_tested": "HEAD",
        "redirect_target": null,
        "status_code": 200,
        "verified_at": "2026-06-06T07:44:02.909Z"
      }
    },
    {
      "auth_required": false,
      "authority": "registry-observed",
      "id": "sn-67-taomarketcap-website",
      "kind": "website",
      "name": "Harnyx website",
      "notes": "Discovered from TaoMarketCap subnet identity metadata. Not probed or verified by Metagraphed.",
      "probe": {
        "enabled": true,
        "expect": "any",
        "method": "HEAD",
        "timeout_ms": 10000
      },
      "provider": "taomarketcap",
      "public_safe": true,
      "quality_signals": {
        "content_type_matches_kind": true,
        "public_safe": true,
        "rate_limited": false,
        "redirected": false,
        "source_tier": "third-party-index",
        "transient_failure": false
      },
      "rate_limit_notes": "Candidate only; no recurring probe is configured until maintainer review.",
      "source_urls": [
        "https://api.taomarketcap.com/public/v1/subnets/67"
      ],
      "url": "https://harnyx.ai/",
      "verification": {
        "classification": "live",
        "confidence_score": 77,
        "content_type": "text/html",
        "latency_ms": 710,
        "method_tested": "HEAD",
        "redirect_target": null,
        "status_code": 200,
        "verified_at": "2026-06-06T07:44:02.845Z"
      }
    },
    {
      "auth_required": false,
      "authority": "registry-observed",
      "id": "sn-67-tensorplex-docs",
      "kind": "docs",
      "name": "Harnyx Tensorplex subnet docs",
      "notes": "Discovered from Tensorplex subnet-docs. Useful as documentation enrichment, not verified operational authority. Source refresh failed; preserved pending a successful refresh.",
      "probe": {
        "enabled": true,
        "expect": "any",
        "method": "HEAD",
        "timeout_ms": 10000
      },
      "provider": "tensorplex-subnet-docs",
      "public_safe": true,
      "quality_signals": {
        "content_type_matches_kind": true,
        "public_safe": true,
        "rate_limited": false,
        "redirected": false,
        "source_tier": "community-docs",
        "transient_failure": false
      },
      "rate_limit_notes": "Candidate only; no recurring probe is configured until maintainer review.",
      "source_urls": [
        "https://github.com/tensorplex-labs/subnet-docs/blob/main/data/67/subnet.json"
      ],
      "url": "https://github.com/tensorplex-labs/subnet-docs/tree/main/data/67",
      "verification": {
        "classification": "live",
        "confidence_score": 73,
        "content_type": "text/html; charset=utf-8",
        "latency_ms": 411,
        "method_tested": "HEAD",
        "redirect_target": null,
        "status_code": 200,
        "verified_at": "2026-06-06T07:44:02.877Z"
      }
    },
    {
      "auth_required": false,
      "authority": "registry-observed",
      "id": "sn-67-github-readme-harnyx-harnyx-dashboard-1",
      "kind": "dashboard",
      "name": "Harnyx dashboard",
      "notes": "Discovered from a public GitHub README link. Requires verification before promotion. Source refresh failed; preserved pending a successful refresh.",
      "probe": {
        "enabled": true,
        "expect": "any",
        "method": "HEAD",
        "timeout_ms": 10000
      },
      "provider": "tensorplex-subnet-docs",
      "public_safe": true,
      "quality_signals": {
        "content_type_matches_kind": true,
        "public_safe": true,
        "rate_limited": false,
        "redirected": false,
        "source_tier": "community-docs",
        "transient_failure": false
      },
      "rate_limit_notes": "Candidate only; no recurring probe is configured until maintainer review.",
      "source_urls": [
        "https://github.com/harnyx/harnyx/blob/main/README.md"
      ],
      "url": "https://dashboard.harnyx.ai/benchmark",
      "verification": {
        "classification": "live",
        "confidence_score": 66,
        "content_type": "text/html; charset=utf-8",
        "latency_ms": 286,
        "method_tested": "HEAD",
        "redirect_target": null,
        "status_code": 200,
        "verified_at": "2026-06-06T07:44:02.818Z"
      }
    },
    {
      "auth_required": false,
      "authority": "registry-observed",
      "id": "sn-67-taomarketcap-dashboard",
      "kind": "dashboard",
      "name": "Harnyx TaoMarketCap dashboard",
      "notes": "Universal TaoMarketCap subnet dashboard candidate. Third-party enrichment, not protocol authority.",
      "probe": {
        "enabled": true,
        "expect": "any",
        "method": "HEAD",
        "timeout_ms": 10000
      },
      "provider": "taomarketcap",
      "public_safe": true,
      "quality_signals": {
        "content_type_matches_kind": true,
        "public_safe": true,
        "rate_limited": false,
        "redirected": false,
        "source_tier": "third-party-index",
        "transient_failure": false
      },
      "rate_limit_notes": "Candidate only; no recurring probe is configured until maintainer review.",
      "source_urls": [
        "https://api.taomarketcap.com/public/v1/subnets/67"
      ],
      "url": "https://taomarketcap.com/subnets/67",
      "verification": {
        "classification": "live",
        "confidence_score": 77,
        "content_type": "text/html; charset=utf-8",
        "latency_ms": 185,
        "method_tested": "HEAD",
        "redirect_target": null,
        "status_code": 200,
        "verified_at": "2026-06-06T07:44:02.823Z"
      }
    }
  ],
  "website_url": "https://harnyx.ai/"
}
