{
  "categories": [
    "baseline-curated"
  ],
  "curation": {
    "gap_notes": [
      "No verified OpenAPI/Swagger surface yet.",
      "No verified subnet API surface yet.",
      "No verified SSE/event stream yet.",
      "No verified data artifact yet."
    ],
    "level": "machine-verified",
    "review_state": "machine-generated",
    "reviewed_at": null,
    "source_count": 2,
    "verified_at": "2026-06-06T07:44:10.301Z"
  },
  "dashboard_url": "https://taomarketcap.com/subnets/120",
  "docs_url": "https://github.com/tensorplex-labs/subnet-docs/tree/main/data/120",
  "links": [],
  "name": "Affine",
  "netuid": 120,
  "notes": "Machine-generated baseline overlay from verified public-source candidates.",
  "schema_version": 1,
  "slug": "sn-120",
  "source_repo": "https://github.com/AffineFoundation/affine",
  "status": "active",
  "surfaces": [
    {
      "auth_required": false,
      "authority": "registry-observed",
      "id": "sn-120-taomarketcap-source-repo",
      "kind": "source-repo",
      "name": "Affine source repository",
      "notes": "Discovered from TaoMarketCap subnet identity metadata. Not probed or verified by Metagraphed.",
      "probe": {
        "enabled": true,
        "expect": "any",
        "method": "HEAD",
        "timeout_ms": 10000
      },
      "provider": "taomarketcap",
      "public_safe": true,
      "quality_signals": {
        "content_type_matches_kind": true,
        "public_safe": true,
        "rate_limited": false,
        "redirected": true,
        "source_tier": "third-party-index",
        "transient_failure": false
      },
      "rate_limit_notes": "Candidate only; no recurring probe is configured until maintainer review.",
      "source_urls": [
        "https://api.taomarketcap.com/public/v1/subnets/120"
      ],
      "url": "https://github.com/AffineFoundation/affine",
      "verification": {
        "classification": "redirected",
        "confidence_score": 54,
        "content_type": null,
        "github_api_url": "https://api.github.com/repos/AffineFoundation/affine",
        "latency_ms": 614,
        "method_tested": "HEAD",
        "redirect_target": "https://github.com/AffineFoundation/affine-cortex",
        "status_code": 200,
        "verified_at": "2026-06-06T07:44:10.289Z"
      }
    },
    {
      "auth_required": false,
      "authority": "registry-observed",
      "id": "sn-120-taomarketcap-website",
      "kind": "website",
      "name": "Affine website",
      "notes": "Discovered from TaoMarketCap subnet identity metadata. Not probed or verified by Metagraphed.",
      "probe": {
        "enabled": true,
        "expect": "any",
        "method": "HEAD",
        "timeout_ms": 10000
      },
      "provider": "taomarketcap",
      "public_safe": true,
      "quality_signals": {
        "content_type_matches_kind": true,
        "public_safe": true,
        "rate_limited": false,
        "redirected": false,
        "source_tier": "third-party-index",
        "transient_failure": false
      },
      "rate_limit_notes": "Candidate only; no recurring probe is configured until maintainer review.",
      "source_urls": [
        "https://api.taomarketcap.com/public/v1/subnets/120"
      ],
      "url": "https://www.affine.io/",
      "verification": {
        "classification": "live",
        "confidence_score": 77,
        "content_type": "text/html; charset=utf-8",
        "latency_ms": 140,
        "method_tested": "HEAD",
        "redirect_target": null,
        "status_code": 200,
        "verified_at": "2026-06-06T07:44:10.297Z"
      }
    },
    {
      "auth_required": false,
      "authority": "registry-observed",
      "id": "sn-120-tensorplex-docs",
      "kind": "docs",
      "name": "Affine Tensorplex subnet docs",
      "notes": "Discovered from Tensorplex subnet-docs. Useful as documentation enrichment, not verified operational authority. Source refresh failed; preserved pending a successful refresh.",
      "probe": {
        "enabled": true,
        "expect": "any",
        "method": "HEAD",
        "timeout_ms": 10000
      },
      "provider": "tensorplex-subnet-docs",
      "public_safe": true,
      "quality_signals": {
        "content_type_matches_kind": true,
        "public_safe": true,
        "rate_limited": false,
        "redirected": false,
        "source_tier": "community-docs",
        "transient_failure": false
      },
      "rate_limit_notes": "Candidate only; no recurring probe is configured until maintainer review.",
      "source_urls": [
        "https://github.com/tensorplex-labs/subnet-docs/blob/main/data/120/subnet.json"
      ],
      "url": "https://github.com/tensorplex-labs/subnet-docs/tree/main/data/120",
      "verification": {
        "classification": "live",
        "confidence_score": 73,
        "content_type": "text/html; charset=utf-8",
        "latency_ms": 371,
        "method_tested": "HEAD",
        "redirect_target": null,
        "status_code": 200,
        "verified_at": "2026-06-06T07:44:10.301Z"
      }
    },
    {
      "auth_required": false,
      "authority": "registry-observed",
      "id": "sn-120-taomarketcap-dashboard",
      "kind": "dashboard",
      "name": "Affine TaoMarketCap dashboard",
      "notes": "Universal TaoMarketCap subnet dashboard candidate. Third-party enrichment, not protocol authority.",
      "probe": {
        "enabled": true,
        "expect": "any",
        "method": "HEAD",
        "timeout_ms": 10000
      },
      "provider": "taomarketcap",
      "public_safe": true,
      "quality_signals": {
        "content_type_matches_kind": true,
        "public_safe": true,
        "rate_limited": false,
        "redirected": false,
        "source_tier": "third-party-index",
        "transient_failure": false
      },
      "rate_limit_notes": "Candidate only; no recurring probe is configured until maintainer review.",
      "source_urls": [
        "https://api.taomarketcap.com/public/v1/subnets/120"
      ],
      "url": "https://taomarketcap.com/subnets/120",
      "verification": {
        "classification": "live",
        "confidence_score": 77,
        "content_type": "text/html; charset=utf-8",
        "latency_ms": 132,
        "method_tested": "HEAD",
        "redirect_target": null,
        "status_code": 200,
        "verified_at": "2026-06-06T07:44:10.267Z"
      }
    }
  ],
  "website_url": "https://www.affine.io/"
}
