{
  "categories": [
    "baseline-curated"
  ],
  "curation": {
    "gap_notes": [
      "No verified OpenAPI/Swagger surface yet.",
      "No verified subnet API surface yet.",
      "No verified SSE/event stream yet.",
      "No verified data artifact yet."
    ],
    "level": "machine-verified",
    "review_state": "machine-generated",
    "reviewed_at": null,
    "source_count": 4,
    "verified_at": "2026-06-06T07:44:09.560Z"
  },
  "dashboard_url": "https://taomarketcap.com/subnets/117",
  "docs_url": "https://github.com/tensorplex-labs/subnet-docs/tree/main/data/117",
  "links": [],
  "name": "Unknown",
  "netuid": 117,
  "notes": "Machine-generated baseline overlay from verified public-source candidates.",
  "schema_version": 1,
  "slug": "sn-117",
  "source_repo": "https://github.com/helionlink/Chi",
  "status": "active",
  "surfaces": [
    {
      "auth_required": false,
      "authority": "registry-observed",
      "id": "sn-117-taomarketcap-source-repo",
      "kind": "source-repo",
      "name": "Unknown source repository",
      "notes": "Discovered from TaoMarketCap subnet identity metadata. Not probed or verified by Metagraphed.",
      "probe": {
        "enabled": true,
        "expect": "any",
        "method": "HEAD",
        "timeout_ms": 10000
      },
      "provider": "taomarketcap",
      "public_safe": true,
      "quality_signals": {
        "content_type_matches_kind": true,
        "public_safe": true,
        "rate_limited": false,
        "redirected": true,
        "source_tier": "third-party-index",
        "transient_failure": false
      },
      "rate_limit_notes": "Candidate only; no recurring probe is configured until maintainer review.",
      "source_urls": [
        "https://api.taomarketcap.com/public/v1/subnets/117"
      ],
      "url": "https://github.com/helionlink/Chi",
      "verification": {
        "classification": "redirected",
        "confidence_score": 54,
        "content_type": null,
        "github_api_url": "https://api.github.com/repos/helionlink/Chi",
        "latency_ms": 646,
        "method_tested": "HEAD",
        "redirect_target": "https://github.com/smallsmilesmith/Chi",
        "status_code": 200,
        "verified_at": "2026-06-06T07:44:09.498Z"
      }
    },
    {
      "auth_required": false,
      "authority": "registry-observed",
      "id": "sn-117-tensorplex-source-repo-1",
      "kind": "source-repo",
      "name": "Unknown source repository",
      "notes": "Discovered from Tensorplex subnet-docs. Not probed or verified by Metagraphed. Source refresh failed; preserved pending a successful refresh.",
      "probe": {
        "enabled": true,
        "expect": "any",
        "method": "HEAD",
        "timeout_ms": 10000
      },
      "provider": "tensorplex-subnet-docs",
      "public_safe": true,
      "quality_signals": {
        "content_type_matches_kind": true,
        "public_safe": true,
        "rate_limited": false,
        "redirected": false,
        "source_tier": "community-docs",
        "transient_failure": false
      },
      "rate_limit_notes": "Candidate only; no recurring probe is configured until maintainer review.",
      "source_urls": [
        "https://github.com/tensorplex-labs/subnet-docs/blob/main/data/117/subnet.json"
      ],
      "url": "https://github.com/shiftlayer-llc/brainplay-subnet",
      "verification": {
        "classification": "live",
        "confidence_score": 55,
        "content_type": null,
        "github_api_url": "https://api.github.com/repos/shiftlayer-llc/brainplay-subnet",
        "latency_ms": 941,
        "method_tested": "HEAD",
        "redirect_target": null,
        "status_code": 200,
        "verified_at": "2026-06-06T07:44:09.518Z"
      }
    },
    {
      "auth_required": false,
      "authority": "registry-observed",
      "id": "sn-117-github-readme-shiftlayer-llc-brainplay-subnet-website-1",
      "kind": "website",
      "name": "Unknown website page",
      "notes": "Discovered from a public GitHub README link. Requires verification before promotion. Source refresh failed; preserved pending a successful refresh.",
      "probe": {
        "enabled": true,
        "expect": "any",
        "method": "HEAD",
        "timeout_ms": 10000
      },
      "provider": "tensorplex-subnet-docs",
      "public_safe": true,
      "quality_signals": {
        "content_type_matches_kind": true,
        "public_safe": true,
        "rate_limited": false,
        "redirected": true,
        "source_tier": "community-docs",
        "transient_failure": false
      },
      "rate_limit_notes": "Candidate only; no recurring probe is configured until maintainer review.",
      "source_urls": [
        "https://github.com/shiftlayer-llc/brainplay-subnet/blob/main/README.md"
      ],
      "url": "https://github.com/shiftlayer-llc/brainplay-subnet.git",
      "verification": {
        "classification": "redirected",
        "confidence_score": 61,
        "content_type": "text/html; charset=utf-8",
        "latency_ms": 628,
        "method_tested": "HEAD",
        "redirect_target": "https://github.com/shiftlayer-llc/brainplay-subnet",
        "status_code": 200,
        "verified_at": "2026-06-06T07:44:09.417Z"
      }
    },
    {
      "auth_required": false,
      "authority": "registry-observed",
      "id": "sn-117-tensorplex-docs",
      "kind": "docs",
      "name": "Unknown Tensorplex subnet docs",
      "notes": "Discovered from Tensorplex subnet-docs. Useful as documentation enrichment, not verified operational authority. Source refresh failed; preserved pending a successful refresh.",
      "probe": {
        "enabled": true,
        "expect": "any",
        "method": "HEAD",
        "timeout_ms": 10000
      },
      "provider": "tensorplex-subnet-docs",
      "public_safe": true,
      "quality_signals": {
        "content_type_matches_kind": true,
        "public_safe": true,
        "rate_limited": false,
        "redirected": false,
        "source_tier": "community-docs",
        "transient_failure": false
      },
      "rate_limit_notes": "Candidate only; no recurring probe is configured until maintainer review.",
      "source_urls": [
        "https://github.com/tensorplex-labs/subnet-docs/blob/main/data/117/subnet.json"
      ],
      "url": "https://github.com/tensorplex-labs/subnet-docs/tree/main/data/117",
      "verification": {
        "classification": "live",
        "confidence_score": 73,
        "content_type": "text/html; charset=utf-8",
        "latency_ms": 334,
        "method_tested": "HEAD",
        "redirect_target": null,
        "status_code": 200,
        "verified_at": "2026-06-06T07:44:09.512Z"
      }
    },
    {
      "auth_required": false,
      "authority": "registry-observed",
      "id": "sn-117-website-common-docs",
      "kind": "docs",
      "name": "Unknown docs",
      "notes": "Common read-only path discovered from a public project website root. Requires verification before promotion. Source refresh failed; preserved pending a successful refresh.",
      "probe": {
        "enabled": true,
        "expect": "any",
        "method": "HEAD",
        "timeout_ms": 10000
      },
      "provider": "tensorplex-subnet-docs",
      "public_safe": true,
      "quality_signals": {
        "content_type_matches_kind": true,
        "public_safe": true,
        "rate_limited": false,
        "redirected": false,
        "source_tier": "provider-claimed",
        "transient_failure": false
      },
      "rate_limit_notes": "Candidate only; no recurring probe is configured until maintainer review.",
      "source_urls": [
        "https://github.com/shiftlayer-llc/brainplay-subnet.git"
      ],
      "url": "https://github.com/docs",
      "verification": {
        "classification": "live",
        "confidence_score": 76,
        "content_type": "text/html; charset=utf-8",
        "latency_ms": 77,
        "method_tested": "HEAD",
        "redirect_target": null,
        "status_code": 200,
        "verified_at": "2026-06-06T07:44:09.560Z"
      }
    },
    {
      "auth_required": false,
      "authority": "registry-observed",
      "id": "sn-117-taomarketcap-dashboard",
      "kind": "dashboard",
      "name": "Unknown TaoMarketCap dashboard",
      "notes": "Universal TaoMarketCap subnet dashboard candidate. Third-party enrichment, not protocol authority.",
      "probe": {
        "enabled": true,
        "expect": "any",
        "method": "HEAD",
        "timeout_ms": 10000
      },
      "provider": "taomarketcap",
      "public_safe": true,
      "quality_signals": {
        "content_type_matches_kind": true,
        "public_safe": true,
        "rate_limited": false,
        "redirected": false,
        "source_tier": "third-party-index",
        "transient_failure": false
      },
      "rate_limit_notes": "Candidate only; no recurring probe is configured until maintainer review.",
      "source_urls": [
        "https://api.taomarketcap.com/public/v1/subnets/117"
      ],
      "url": "https://taomarketcap.com/subnets/117",
      "verification": {
        "classification": "live",
        "confidence_score": 77,
        "content_type": "text/html; charset=utf-8",
        "latency_ms": 396,
        "method_tested": "HEAD",
        "redirect_target": null,
        "status_code": 200,
        "verified_at": "2026-06-06T07:44:09.498Z"
      }
    }
  ],
  "website_url": "https://github.com/shiftlayer-llc/brainplay-subnet.git"
}
